{
  "request_id": "req-allow-1",
  "scan_status": "complete",
  "assessment": {
    "label": "no_injection_detected",
    "categories": [],
    "evidence": []
  },
  "decision": {
    "action": "allow",
    "reason_code": "clean_complete_scan"
  },
  "coverage": {
    "original_utf8_bytes": 82,
    "scanned_utf8_bytes": 82,
    "truncated": false
  },
  "versions": {
    "contract": "1.0.0",
    "detector": "fake-0",
    "prompt": "none",
    "policy": "monitoring-1"
  }
}
